{
  "protocol_version": "agent.v1",
  "provider": "openai-compatible",
  "model": "gpt-5-mini",
  "messages": [
    {
      "role": "user",
      "content": "Return a project summary object.",
      "metadata": {}
    }
  ],
  "response_format": {
    "type": "json_schema",
    "name": "project_summary",
    "schema": {
      "type": "object",
      "required": ["title", "status"],
      "properties": {
        "title": { "type": "string" },
        "status": { "type": "string", "enum": ["ok", "blocked"] }
      },
      "additionalProperties": false
    },
    "strict": true
  },
  "metadata": {
    "prompt_version": "structured.v1"
  }
}
